Program Name;Description;Program Status;Organization Name;Program Population Served;Address Extra Info;Location Address;Local Areas;Provides Meals;Provides Hampers;Delivery Available;Takeout Available;Wheelchair Accessible;Meal Cost;Hamper Cost;Signup Required;Signup Phone Number;Signup Email;Requires Referral;Referral Agency Name;Referral Phone Number;Referral Email;Latitude;Longitude;Last Update Date;geom
VCH - Healthiest Babies Possible Food Support;Food access and other supports available. To sign up, drop in or phone Mon ,Wed, Fri 8:30am-4:30pm or Thurs 9:15a.m-5:30p.m.;Open;Vancouver Coastal Health;prenatal or pregnant women and youth facing challenging life circumstances;Suite 201;1669 E Broadway, Vancouver, BC;Grandview-Woodland;False;True;Yes;Unknown;Unknown;;Free;Yes;604 675 3982;hbp@vch.ca;No;;;;49.262625;-123.070543;2022-08-10T10:08:05-06:00;49.262625,-123.070543
Saige Community Food Bank - Food Hamper Delivery;No barrier program for LGBTQ2+ individuals. Provides a food hamper with fresh produce and baked goods delivered to your home.;Open;Saige Community Food Bank;;;2425 Oxford St, Vancouver, BC;Hastings-Sunrise;False;True;Yes;Unknown;Unknown;;Free;Yes;;info@saigecommunityfoodbank.com;No;;;;49.286005;-123.055856;2022-08-23T04:03:38-06:00;49.286005,-123.055856
Food Stash - Rescued Food Market;"Th, 3-5:30pm perishable food market (fruit, vegetables, dairy, meat) on a 'pay what you feel' basis; no payment required (donations accepted but optional). Market will be moving to 290 E 1st Ave as of August 29th";Open;Food Stash Foundation;;;290 E 1st Ave, Vancouver, BC;Strathcona;False;True;No;No;Unknown;;;No;;;No;;;;49.268401;-123.097959;2022-08-23T04:48:57-06:00;49.268401,-123.097959
Vancouver Community Fridge - Kitsilano;Fridge and pantry stocked with free food, located in the alley by the red house and garden at the above address. Accessible 24/7. More info at https://vcfp.square.site/;Open;Vancouver Community Fridge Project;;Located in the alley by the red house and big garden.;3066 West 13th Ave;Kitsilano;False;True;No;Unknown;Yes;;Free;No;;;No;;;;49.26029;-123.173496;2022-08-09T10:54:32-06:00;49.26029,-123.173496
Care BC - Chinese Meals on Wheels;Chinese meals delivered weekdays 11am-1pm by Chinese speaking volunteers. Must be home to receive the meals. More info at https://www.carebc.ca/chinese-mow-vancouverrichmond.html;Open;Health and Home Care Society of BC (aka Care BC);home-bound people including seniors, caregivers, people with illness or injury.;204;3077 Granville St, Vancouver, BC;Fairview;True;False;Yes;Unknown;Unknown;$9.00;;Yes;604-733-6615;cmow@carebc.ca;No;;;;49.258422;-123.139174;2022-08-10T09:56:31-06:00;49.258422,-123.139174
Kitsilano Farmers Market - Nutrition Coupons;Vancouver Farmers Market location accepting Nutrition Coupons. Enrolled households receive minimum of $21/week in vouchers. Market is open May – October, Saturdays 9:30am-2:30pm.;Open;Vancouver Farmers Markets;eligible families enrolled through a community partner. Visit https://bcfarmersmarket.org/coupon-program/where-it-operates/ to find a community partner.;Kits Community Centre parking lot;2690 Larch St, Vancouver, BC;Kitsilano;False;True;Unknown;Unknown;Unknown;;Free;Yes;;https://bcfarmersmarket.org/coupon-program/get-involved/individuals/;No;;;;49.262056;-123.160105;2022-08-10T09:58:08-06:00;49.262056,-123.160105
Trout Lake Farmers Market - Nutrition Coupons;Vancouver Farmers Market location accepting Nutrition Coupons. Enrolled households receive minimum of $21/week in vouchers. Market is open May – October, Saturdays 9am-2pm.;Open;Vancouver Farmers Markets;eligible families enrolled through Vancouver Farmers Market Society;;2950 Lakewood Dr, Vancouver, BC;Kensington-Cedar Cottage;False;True;No;Unknown;Unknown;;Free;Yes;;https://bcfarmersmarket.org/coupon-program/get-involved/individuals/;No;;;;49.258336;-123.061898;2022-08-10T09:58:20-06:00;49.258336,-123.061898
Collingwood Community Fridge and Pantry;Fridge and pantry stocked with free food, and located on the west facing side of Collingwood Neighbourhood House, adjacent to the gym entrance. Open 24/7. Wheelchair accessible. More info at https://rcfood.wordpress.com/collingwood-neighbourhood-food-hub/fridge/ or foodhub@cnh.bc.ca;Open;Collingwood Neighbourhood House;;;5288 Joyce St, Vancouver, BC;Renfrew-Collingwood;False;True;No;Unknown;Yes;;Free;No;;;No;;;;49.236608;-123.032888;2022-08-10T09:56:57-06:00;49.236608,-123.032888
